{
  "schema_version": "0.3.0",
  "as_of_date": "2026-09-07",
  "record_count": 11,
  "records": [
    {
      "id": "african-continental-free-trade-area",
      "name": "African Continental Free Trade Area",
      "short_name": "AfCFTA",
      "relationship_type": "free-trade-area",
      "members": [
        {
          "type": "country",
          "id": "AO",
          "status": "party"
        },
        {
          "type": "country",
          "id": "BF",
          "status": "party"
        },
        {
          "type": "country",
          "id": "BI",
          "status": "party"
        },
        {
          "type": "country",
          "id": "BJ",
          "status": "signatory"
        },
        {
          "type": "country",
          "id": "BW",
          "status": "party"
        },
        {
          "type": "country",
          "id": "CD",
          "status": "party"
        },
        {
          "type": "country",
          "id": "CF",
          "status": "party"
        },
        {
          "type": "country",
          "id": "CG",
          "status": "party"
        },
        {
          "type": "country",
          "id": "CI",
          "status": "party"
        },
        {
          "type": "country",
          "id": "CM",
          "status": "party"
        },
        {
          "type": "country",
          "id": "CV",
          "status": "party"
        },
        {
          "type": "country",
          "id": "DJ",
          "status": "party"
        },
        {
          "type": "country",
          "id": "DZ",
          "status": "party"
        },
        {
          "type": "country",
          "id": "EG",
          "status": "party"
        },
        {
          "type": "country",
          "id": "EH",
          "status": "party"
        },
        {
          "type": "country",
          "id": "ET",
          "status": "party"
        },
        {
          "type": "country",
          "id": "GA",
          "status": "party"
        },
        {
          "type": "country",
          "id": "GH",
          "status": "party"
        },
        {
          "type": "country",
          "id": "GM",
          "status": "party"
        },
        {
          "type": "country",
          "id": "GN",
          "status": "party"
        },
        {
          "type": "country",
          "id": "GQ",
          "status": "party"
        },
        {
          "type": "country",
          "id": "GW",
          "status": "party"
        },
        {
          "type": "country",
          "id": "KE",
          "status": "party"
        },
        {
          "type": "country",
          "id": "KM",
          "status": "party"
        },
        {
          "type": "country",
          "id": "LR",
          "status": "party"
        },
        {
          "type": "country",
          "id": "LS",
          "status": "party"
        },
        {
          "type": "country",
          "id": "LY",
          "status": "signatory"
        },
        {
          "type": "country",
          "id": "MA",
          "status": "party"
        },
        {
          "type": "country",
          "id": "MG",
          "status": "party"
        },
        {
          "type": "country",
          "id": "ML",
          "status": "party"
        },
        {
          "type": "country",
          "id": "MR",
          "status": "party"
        },
        {
          "type": "country",
          "id": "MU",
          "status": "party"
        },
        {
          "type": "country",
          "id": "MW",
          "status": "party"
        },
        {
          "type": "country",
          "id": "MZ",
          "status": "party"
        },
        {
          "type": "country",
          "id": "NA",
          "status": "party"
        },
        {
          "type": "country",
          "id": "NE",
          "status": "party"
        },
        {
          "type": "country",
          "id": "NG",
          "status": "party"
        },
        {
          "type": "country",
          "id": "RW",
          "status": "party"
        },
        {
          "type": "country",
          "id": "SC",
          "status": "party"
        },
        {
          "type": "country",
          "id": "SD",
          "status": "signatory"
        },
        {
          "type": "country",
          "id": "SL",
          "status": "party"
        },
        {
          "type": "country",
          "id": "SN",
          "status": "party"
        },
        {
          "type": "country",
          "id": "SO",
          "status": "signatory"
        },
        {
          "type": "country",
          "id": "SS",
          "status": "signatory"
        },
        {
          "type": "country",
          "id": "ST",
          "status": "party"
        },
        {
          "type": "country",
          "id": "SZ",
          "status": "party"
        },
        {
          "type": "country",
          "id": "TD",
          "status": "party"
        },
        {
          "type": "country",
          "id": "TG",
          "status": "party"
        },
        {
          "type": "country",
          "id": "TN",
          "status": "party"
        },
        {
          "type": "country",
          "id": "TZ",
          "status": "party"
        },
        {
          "type": "country",
          "id": "UG",
          "status": "party"
        },
        {
          "type": "country",
          "id": "ZA",
          "status": "party"
        },
        {
          "type": "country",
          "id": "ZM",
          "status": "party"
        },
        {
          "type": "country",
          "id": "ZW",
          "status": "party"
        }
      ],
      "official_website": "https://au-afcfta.org/",
      "source_ids": [
        "afcfta-status"
      ],
      "last_verified": "2026-09-06",
      "notes": "Status distinguishes deposited parties from signatories; Eritrea is not listed because it had not signed as of the snapshot date."
    },
    {
      "id": "african-union",
      "name": "African Union",
      "short_name": "AU",
      "relationship_type": "intergovernmental-organization",
      "members": [
        {
          "type": "country",
          "id": "AO",
          "status": "member"
        },
        {
          "type": "country",
          "id": "BF",
          "status": "member"
        },
        {
          "type": "country",
          "id": "BI",
          "status": "member"
        },
        {
          "type": "country",
          "id": "BJ",
          "status": "member"
        },
        {
          "type": "country",
          "id": "BW",
          "status": "member"
        },
        {
          "type": "country",
          "id": "CD",
          "status": "member"
        },
        {
          "type": "country",
          "id": "CF",
          "status": "member"
        },
        {
          "type": "country",
          "id": "CG",
          "status": "member"
        },
        {
          "type": "country",
          "id": "CI",
          "status": "member"
        },
        {
          "type": "country",
          "id": "CM",
          "status": "member"
        },
        {
          "type": "country",
          "id": "CV",
          "status": "member"
        },
        {
          "type": "country",
          "id": "DJ",
          "status": "member"
        },
        {
          "type": "country",
          "id": "DZ",
          "status": "member"
        },
        {
          "type": "country",
          "id": "EG",
          "status": "member"
        },
        {
          "type": "country",
          "id": "EH",
          "status": "member"
        },
        {
          "type": "country",
          "id": "ER",
          "status": "member"
        },
        {
          "type": "country",
          "id": "ET",
          "status": "member"
        },
        {
          "type": "country",
          "id": "GA",
          "status": "member"
        },
        {
          "type": "country",
          "id": "GH",
          "status": "member"
        },
        {
          "type": "country",
          "id": "GM",
          "status": "member"
        },
        {
          "type": "country",
          "id": "GN",
          "status": "member"
        },
        {
          "type": "country",
          "id": "GQ",
          "status": "member"
        },
        {
          "type": "country",
          "id": "GW",
          "status": "member"
        },
        {
          "type": "country",
          "id": "KE",
          "status": "member"
        },
        {
          "type": "country",
          "id": "KM",
          "status": "member"
        },
        {
          "type": "country",
          "id": "LR",
          "status": "member"
        },
        {
          "type": "country",
          "id": "LS",
          "status": "member"
        },
        {
          "type": "country",
          "id": "LY",
          "status": "member"
        },
        {
          "type": "country",
          "id": "MA",
          "status": "member"
        },
        {
          "type": "country",
          "id": "MG",
          "status": "member"
        },
        {
          "type": "country",
          "id": "ML",
          "status": "member"
        },
        {
          "type": "country",
          "id": "MR",
          "status": "member"
        },
        {
          "type": "country",
          "id": "MU",
          "status": "member"
        },
        {
          "type": "country",
          "id": "MW",
          "status": "member"
        },
        {
          "type": "country",
          "id": "MZ",
          "status": "member"
        },
        {
          "type": "country",
          "id": "NA",
          "status": "member"
        },
        {
          "type": "country",
          "id": "NE",
          "status": "member"
        },
        {
          "type": "country",
          "id": "NG",